Match,Date,M/Inns,Versus,Ground,Batsman Dismissed,Overs,Wickets,,S/R,E/R,Wkts,Avg
1,22/04/2018,1st,Mumbai Indians,Sawai Mansingh Stadium,K H Pandya (c H Klaasen),4.0,3/22,,8.00,5.50,1,7.33
,,,,,H H Pandya (b),,,,,,2,
,,,,,M J McClenaghan (b),,,,,,3,
2,29/04/2018,1st,Sunrisers Hyderabad,Sawai Mansingh Stadium,Shakib Al Hasan (b),4.0,3/26,,8.00,6.00,4,8.00
,,,,,Y K Pathan (c D S Kulkarni),,,,,,5,
,,,,,Rashid Khan (c B A Stokes),,,,,,6,
3,02/05/2018,1st,Delhi Capitals,Arun Jaitley Stadium,G J Maxwell (lbw),3.1,1/31,,9.57,7.07,7,11.29
4,06/05/2018,2nd,Punjab Kings,Holkar Cricket Stadium,C H Gayle (c S V Samson),3.4,1/43,,11.13,8.22,8,15.25
5,08/05/2018,2nd,Punjab Kings,Sawai Mansingh Stadium,K K Nair (c J D Unadkat),4.0,1/32,,12.56,8.18,9,17.11
6,11/05/2018,1st,Chennai Super Kings,Sawai Mansingh Stadium,A T Rayudu (b),4.0,2/42,,12.45,8.58,10,17.82
,,,,,S R Watson (c †J C Buttler),,,,,,11,
7,13/05/2018,1st,Mumbai Indians,Wankhede Stadium,S A Yadav (c J D Unadkat),4.0,2/16,,12.38,7.90,12,16.31
,,,,,R G Sharma (c J D Unadkat),,,,,,13,
8,15/05/2018,2nd,Kolkata Knight Riders,Eden Gardens,,4.0,0/43,,14.23,8.27,13,19.62
9,19/05/2018,2nd,Royal Challengers Bengaluru,Sawai Mansingh Stadium,,4.0,0/37,,16.08,8.38,13,22.46
10,23/05/2018,1st,Kolkata Knight Riders,Eden Gardens,N Rana (c J D Unadkat),4.0,2/33,,15.53,8.37,14,21.67
,,,,,Shubman Gill (c †H Klaasen),,,,,,15,
11,25/03/2019,1st,Punjab Kings,Sawai Mansingh Stadium,,4.0,0/17,,17.13,7.98,15,22.80
12,29/03/2019,2nd,Sunrisers Hyderabad,Rajiv Gandhi International Stadium,,4.0,0/42,,18.73,8.20,15,25.60
13,31/03/2019,1st,Chennai Super Kings,MA Chidambaram Stadium,A T Rayudu (c †J C Buttler),4.0,2/17,,17.94,7.89,16,23.59
,,,,,D J J Bravo (c D S Kulkarni),,,,,,17,
14,02/04/2019,1st,Royal Challengers Bengaluru,Sawai Mansingh Stadium,P A Patel (c A M Rahane),4.0,1/47,,18.28,8.17,18,24.89
15,07/04/2019,2nd,Kolkata Knight Riders,Sawai Mansingh Stadium,,3.0,0/14,,19.28,7.99,18,25.67
16,11/04/2019,2nd,Chennai Super Kings,Sawai Mansingh Stadium,K M Jadhav (c B A Stokes),4.0,1/19,,19.53,7.78,19,25.32
17,13/04/2019,1st,Mumbai Indians,Wankhede Stadium,R G Sharma (c J C Buttler),4.0,3/39,,17.95,7.90,20,23.64
,,,,,K A Pollard (c S Gopal),,,,,,21,
,,,,,Q de Kock (c J C Buttler),,,,,,22,
18,16/04/2019,1st,Punjab Kings,Punjab Cricket Association IS Bindra Stadium,C H Gayle (c †S V Samson),4.0,3/15,,16.76,7.66,23,21.40
,,,,,N Pooran (c A M Rahane),,,,,,24,
,,,,,Mandeep Singh (b),,,,,,25,
19,20/04/2019,1st,Mumbai Indians,Sawai Mansingh Stadium,H H Pandya (lbw),4.0,1/22,,17.04,7.54,26,21.42
20,22/04/2019,2nd,Delhi Capitals,Sawai Mansingh Stadium,,4.0,0/31,,17.96,7.55,26,22.62
21,25/04/2019,1st,Kolkata Knight Riders,Eden Gardens,,4.0,0/28,,18.88,7.53,26,23.69
22,22/09/2020,2nd,Chennai Super Kings,Sharjah Cricket Stadium,F du Plessis (c †S V Samson),4.0,1/26,,19.07,7.48,27,23.78
23,27/09/2020,1st,Punjab Kings,Sharjah Cricket Stadium,,4.0,0/46,,19.96,7.66,27,25.48
24,30/09/2020,1st,Kolkata Knight Riders,Dubai International Cricket Stadium,Shubman Gill (c & b),4.0,2/18,,19.41,7.52,28,24.34
,,,,,K D Karthik (c †J C Buttler),,,,,,29,
25,03/10/2020,2nd,Royal Challengers Bengaluru,Sheikh Zayed Stadium,D Padikkal (b),4.0,1/18,,19.57,7.40,30,24.13
26,06/10/2020,1st,Mumbai Indians,Sheikh Zayed Stadium,K H Pandya (c S Gopal),4.0,1/34,,19.71,7.44,31,24.45
27,09/10/2020,1st,Delhi Capitals,Sharjah Cricket Stadium,S Dhawan (c Y B K Jaiswal),4.0,3/24,,18.68,7.39,32,23.00
,,,,,P P Shaw (c & b),,,,,,33,
,,,,,H V Patel (c R Tewatia),,,,,,34,
28,11/10/2020,1st,Sunrisers Hyderabad,Dubai International Cricket Stadium,D A Warner (b),4.0,1/25,,18.83,7.35,35,23.06
29,14/10/2020,1st,Delhi Capitals,Dubai International Cricket Stadium,P P Shaw (b),4.0,3/19,,17.97,7.26,36,21.74
,,,,,A M Rahane (c R V Uthappa),,,,,,37,
,,,,,M P Stoinis (c R Tewatia),,,,,,38,
30,17/10/2020,2nd,Royal Challengers Bengaluru,Dubai International Cricket Stadium,,3.4,0/38,,18.55,7.35,38,22.74
31,19/10/2020,1st,Chennai Super Kings,Sheikh Zayed Stadium,F du Plessis (c J C Buttler),4.0,1/20,,18.69,7.28,39,22.67
32,22/10/2020,2nd,Sunrisers Hyderabad,Dubai International Cricket Stadium,D A Warner (c B A Stokes),4.0,2/21,,18.37,7.21,40,22.07
,,,,,J M Bairstow (b),,,,,,41,
33,25/10/2020,1st,Mumbai Indians,Sheikh Zayed Stadium,Q de Kock (b),4.0,2/31,,18.07,7.23,42,21.77
,,,,,S S Tiwary (c B A Stokes),,,,,,43,
34,30/10/2020,1st,Punjab Kings,Sheikh Zayed Stadium,Mandeep Singh (c B A Stokes),4.0,2/26,,17.80,7.21,44,21.38
,,,,,C H Gayle (b),,,,,,45,
35,01/11/2020,1st,Kolkata Knight Riders,Dubai International Cricket Stadium,N Rana (c †S V Samson),4.0,1/19,,17.93,7.13,46,21.33
36,02/04/2023,2nd,Royal Challengers Bengaluru,M Chinnaswamy Stadium,,4.0,0/33,,18.46,7.17,46,22.04
37,22/04/2023,1st,Punjab Kings,Wankhede Stadium,S M Curran (c & b),4.0,1/42,,18.57,7.26,47,22.47
38,30/04/2023,1st,Rajasthan Royals,Wankhede Stadium,J O Holder (c T H David),4.0,1/35,,18.69,7.30,48,22.73
39,03/05/2023,1st,Punjab Kings,Punjab Cricket Association IS Bindra Stadium,,4.0,0/56,,19.19,7.47,48,23.90
40,06/05/2023,2nd,Chennai Super Kings,MA Chidambaram Stadium,,4.0,0/24,,19.69,7.43,48,24.40
41,23/03/2025,1st,Sunrisers Hyderabad,Rajiv Gandhi International Stadium,,4.0,0/76,,20.19,7.72,48,25.98
42,26/03/2025,2nd,Kolkata Knight Riders,Barsapara Cricket Stadium,,2.3,0/33,,20.50,7.80,48,26.67
43,30/03/2025,2nd,Chennai Super Kings,Barsapara Cricket Stadium,R Ravindra (c †D C Jurel),3.0,1/13,,20.45,7.74,49,26.39
44,05/04/2025,2nd,Punjab Kings,Maharaja Yadavindra Singh International Cricket St,P Arya (b),4.0,3/25,,19.73,7.71,50,25.35
,,,,,S S Iyer (b),,,,,,51,
,,,,,Arshdeep Singh (c P W H de Silva),,,,,,52,
45,09/04/2025,1st,Gujarat Titans,Narendra Modi Stadium,Shubman Gill (b),4.0,1/30,,19.81,7.70,53,25.43
46,13/04/2025,2nd,Royal Challengers Bengaluru,Sawai Mansingh Stadium,,4.0,0/36,,20.26,7.73,53,26.11
47,16/04/2025,1st,Delhi Capitals,Arun Jaitley Stadium,J Fraser-McGurk (c Y B K Jaiswal),4.0,2/32,,19.96,7.74,54,25.75
,,,,,K L Rahul (c S O Hetmeyer),,,,,,55,
48,19/04/2025,1st,Lucknow Super Giants,Sawai Mansingh Stadium,M R Marsh (c S O Hetmeyer),4.0,1/32,,20.04,7.74,56,25.86
