Match,Date,M/Inns,Versus,Ground,Batsman Dismissed,Overs,Wickets,,S/R,E/R,Wkts,Avg
1,16/04/2016,2nd,Gujarat Lions,Wankhede Stadium,K D Karthik (c Harbhajan Singh),4.0,1/20,,24.00,5.00,1,20.00
2,18/04/2016,2nd,Sunrisers Hyderabad,Rajiv Gandhi International Stadium,did not bowl,,,,24.00,5.00,1,20.00
3,20/04/2016,1st,Royal Challengers Bengaluru,Barabati Stadium,V Kohli (c T G Southee),4.0,2/27,,16.00,5.88,2,15.67
,,,,,A B de Villiers (st P A Patel),,,,,,3,
4,23/04/2016,1st,Delhi Capitals,Arun Jaitley Stadium,,4.0,0/25,,24.00,6.00,3,24.00
5,25/04/2016,2nd,Punjab Kings,Punjab Cricket Association IS Bindra Stadium,,2.0,0/20,,28.00,6.57,3,30.67
6,28/04/2016,1st,Kolkata Knight Riders,Wankhede Stadium,,2.0,0/21,,32.00,7.06,3,37.67
7,01/05/2016,1st,Rising Pune Supergiant,Maharashtra Cricket Association Stadium,,2.0,0/28,,36.00,7.83,3,47.00
8,08/05/2016,1st,Sunrisers Hyderabad,Dr YS Rajasekhara Reddy Cricket Stadium,,1.0,0/5,,38.00,7.68,3,48.67
9,11/05/2016,1st,Royal Challengers Bengaluru,M Chinnaswamy Stadium,A B de Villiers (c A T Rayudu),4.0,1/15,,34.50,7.00,4,40.25
10,13/05/2016,2nd,Punjab Kings,Dr YS Rajasekhara Reddy Cricket Stadium,,4.0,0/32,,40.50,7.15,4,48.25
11,15/05/2016,2nd,Delhi Capitals,Dr YS Rajasekhara Reddy Cricket Stadium,Q de Kock (c †J C Buttler),2.1,2/15,,29.17,7.13,5,34.67
,,,,,Z Khan (b),,,,,,6,
12,21/05/2016,2nd,Gujarat Lions,Green Park,,2.0,0/28,,31.17,7.57,6,39.33
13,06/04/2017,2nd,Rising Pune Supergiant,Maharashtra Cricket Association Stadium,,2.0,0/21,,33.17,7.75,6,42.83
14,09/04/2017,1st,Kolkata Knight Riders,Wankhede Stadium,G Gambhir (c M J McClenaghan),4.0,3/24,,24.78,7.56,7,31.22
,,,,,R V Uthappa (c H H Pandya),,,,,,8,
,,,,,Y K Pathan (c H H Pandya),,,,,,9,
15,12/04/2017,1st,Sunrisers Hyderabad,Wankhede Stadium,,1.0,0/12,,25.44,7.68,9,32.56
16,14/04/2017,1st,Royal Challengers Bengaluru,M Chinnaswamy Stadium,A B de Villiers (c R G Sharma),4.0,1/21,,25.30,7.45,10,31.40
17,16/04/2017,1st,Gujarat Lions,Wankhede Stadium,,3.0,0/18,,27.10,7.35,10,33.20
18,20/04/2017,1st,Punjab Kings,Holkar Cricket Stadium,W P Saha (b),4.0,1/29,,26.82,7.34,11,32.82
19,22/04/2017,2nd,Delhi Capitals,Wankhede Stadium,,1.0,0/8,,27.36,7.36,11,33.55
20,29/04/2017,1st,Gujarat Lions,Saurashtra Cricket Association Stadium,K D Karthik (st P A Patel),4.0,3/14,,23.21,7.07,12,27.36
,,,,,R A Jadeja (c & b),,,,,,13,
,,,,,I K Pathan (c H H Pandya),,,,,,14,
21,01/05/2017,1st,Royal Challengers Bengaluru,Wankhede Stadium,T M Head (c H H Pandya),4.0,2/34,,21.81,7.17,15,26.06
,,,,,A B de Villiers (c J J Bumrah),,,,,,16,
22,13/05/2017,2nd,Kolkata Knight Riders,Eden Gardens,,2.0,0/14,,22.56,7.16,16,26.94
23,16/05/2017,1st,Rising Pune Supergiant,Wankhede Stadium,,4.0,0/22,,24.06,7.06,16,28.31
24,19/05/2017,1st,Kolkata Knight Riders,M Chinnaswamy Stadium,,3.0,0/25,,25.19,7.12,16,29.88
25,21/05/2017,2nd,Rising Pune Supergiant,Rajiv Gandhi International Stadium,,4.0,0/31,,26.69,7.15,16,31.81
26,07/04/2018,2nd,Chennai Super Kings,Wankhede Stadium,did not bowl,,,,26.69,7.15,16,31.81
27,12/04/2018,2nd,Sunrisers Hyderabad,Rajiv Gandhi International Stadium,,2.0,0/10,,27.44,7.09,16,32.44
28,14/04/2018,2nd,Delhi Capitals,Wankhede Stadium,R R Pant (c K A Pollard),3.0,2/21,,25.39,7.09,17,30.00
,,,,,G J Maxwell (c H H Pandya),,,,,,18,
29,17/04/2018,2nd,Royal Challengers Bengaluru,Wankhede Stadium,Mandeep Singh (st Ishan Kishan),4.0,3/28,,22.90,7.09,19,27.05
,,,,,C J Anderson (c sub),,,,,,20,
,,,,,Washington Sundar (c S A Yadav),,,,,,21,
30,22/04/2018,2nd,Rajasthan Royals,Sawai Mansingh Stadium,R A Tripathi (c S A Yadav),4.0,1/33,,22.95,7.14,22,27.32
31,24/04/2018,1st,Sunrisers Hyderabad,Wankhede Stadium,,2.0,0/14,,23.50,7.14,22,27.95
32,28/04/2018,1st,Chennai Super Kings,Maharashtra Cricket Association Stadium,S R Watson (c M Markande),4.0,2/32,,22.54,7.18,23,26.96
,,,,,A T Rayudu (c B C J Cutting),,,,,,24,
33,01/05/2018,1st,Royal Challengers Bengaluru,M Chinnaswamy Stadium,,4.0,0/24,,23.54,7.13,24,27.96
34,04/05/2018,1st,Punjab Kings,Holkar Cricket Stadium,,1.0,0/10,,23.79,7.16,24,28.38
35,06/05/2018,2nd,Kolkata Knight Riders,Wankhede Stadium,S P Narine (c R G Sharma),3.0,1/29,,23.56,7.23,25,28.40
36,09/05/2018,2nd,Kolkata Knight Riders,Eden Gardens,T K Curran (c J-P Duminy),3.1,2/12,,22.52,7.13,26,26.74
,,,,,Kuldeep Yadav (lbw),,,,,,27,
37,13/05/2018,2nd,Rajasthan Royals,Wankhede Stadium,,4.0,0/24,,23.41,7.08,27,27.63
38,16/05/2018,2nd,Punjab Kings,Wankhede Stadium,,4.0,0/36,,24.30,7.15,27,28.96
39,20/05/2018,1st,Delhi Capitals,Arun Jaitley Stadium,R R Pant (c K A Pollard),2.0,1/11,,23.86,7.12,28,28.32
40,24/03/2019,1st,Delhi Capitals,Wankhede Stadium,,2.0,0/21,,24.29,7.18,28,29.07
41,28/03/2019,2nd,Royal Challengers Bengaluru,M Chinnaswamy Stadium,,4.0,0/28,,25.14,7.18,28,30.07
42,30/03/2019,2nd,Punjab Kings,Punjab Cricket Association IS Bindra Stadium,C H Gayle (c H H Pandya),4.0,2/43,,24.27,7.29,29,29.50
,,,,,M A Agarwal (c & b),,,,,,30,
43,03/04/2019,2nd,Chennai Super Kings,Wankhede Stadium,,2.0,0/12,,24.67,7.27,30,29.90
44,06/04/2019,2nd,Sunrisers Hyderabad,Rajiv Gandhi International Stadium,,2.0,0/9,,25.07,7.23,30,30.20
45,10/04/2019,1st,Punjab Kings,Wankhede Stadium,,2.0,0/17,,25.47,7.25,30,30.77
46,13/04/2019,2nd,Rajasthan Royals,Wankhede Stadium,A M Rahane (c S A Yadav),4.0,3/34,,23.88,7.29,31,29.00
,,,,,R A Tripathi (c H H Pandya),,,,,,32,
,,,,,L S Livingstone (b),,,,,,33,
47,15/04/2019,1st,Royal Challengers Bengaluru,Wankhede Stadium,,1.0,0/10,,24.06,7.31,33,29.30
48,18/04/2019,2nd,Delhi Capitals,Arun Jaitley Stadium,C Munro (b),2.0,1/7,,23.71,7.25,34,28.65
49,20/04/2019,2nd,Rajasthan Royals,Sawai Mansingh Stadium,,2.0,0/24,,24.06,7.32,34,29.35
50,26/04/2019,2nd,Chennai Super Kings,MA Chidambaram Stadium,A T Rayudu (b),3.0,2/7,,23.22,7.21,35,27.92
,,,,,K M Jadhav (b),,,,,,36,
51,28/04/2019,1st,Kolkata Knight Riders,Eden Gardens,,3.0,0/27,,23.72,7.25,36,28.67
52,02/05/2019,2nd,Sunrisers Hyderabad,Wankhede Stadium,K S Williamson (lbw),4.0,2/22,,23.11,7.20,37,27.74
,,,,,V Shankar (c K A Pollard),,,,,,38,
53,05/05/2019,1st,Kolkata Knight Riders,Wankhede Stadium,,4.0,0/14,,23.74,7.10,38,28.11
54,07/05/2019,1st,Chennai Super Kings,MA Chidambaram Stadium,S R Watson (c J Yadav),4.0,1/21,,23.74,7.06,39,27.92
55,12/05/2019,2nd,Chennai Super Kings,Rajiv Gandhi International Stadium,F du Plessis (st Q de Kock),3.0,1/39,,23.60,7.17,40,28.20
56,19/09/2020,2nd,Chennai Super Kings,Sheikh Zayed Stadium,R A Jadeja (lbw),4.0,1/37,,23.61,7.22,41,28.41
57,23/09/2020,2nd,Kolkata Knight Riders,Sheikh Zayed Stadium,,1.0,0/10,,23.76,7.24,41,28.66
58,28/09/2020,1st,Royal Challengers Bengaluru,Dubai International Cricket Stadium,,3.0,0/23,,24.20,7.25,41,29.22
59,01/10/2020,2nd,Punjab Kings,Sheikh Zayed Stadium,K K Nair (b),4.0,1/27,,24.19,7.23,42,29.17
60,04/10/2020,2nd,Sunrisers Hyderabad,Sharjah Cricket Stadium,P K Garg (c R D Chahar),4.0,1/35,,24.19,7.27,43,29.30
61,06/10/2020,2nd,Rajasthan Royals,Sheikh Zayed Stadium,,2.0,0/22,,24.47,7.31,43,29.81
62,11/10/2020,1st,Delhi Capitals,Sheikh Zayed Stadium,A M Rahane (lbw),4.0,2/26,,23.91,7.29,44,29.07
,,,,,S S Iyer (c T A Boult),,,,,,45,
63,16/10/2020,1st,Kolkata Knight Riders,Sheikh Zayed Stadium,,4.0,0/23,,24.44,7.26,45,29.58
64,18/10/2020,2nd,Punjab Kings,Dubai International Cricket Stadium,,2.0,0/12,,24.71,7.25,45,29.84
65,23/10/2020,1st,Chennai Super Kings,Sharjah Cricket Stadium,,3.0,0/16,,25.11,7.22,45,30.20
66,25/10/2020,2nd,Rajasthan Royals,Sheikh Zayed Stadium,,2.0,0/20,,25.38,7.25,45,30.64
67,28/10/2020,1st,Royal Challengers Bengaluru,Sheikh Zayed Stadium,,4.0,0/27,,25.91,7.23,45,31.24
68,31/10/2020,1st,Delhi Capitals,Dubai International Cricket Stadium,,3.0,0/13,,26.31,7.19,45,31.53
69,03/11/2020,2nd,Sunrisers Hyderabad,Sharjah Cricket Stadium,,3.1,0/37,,26.73,7.26,45,32.36
70,05/11/2020,2nd,Delhi Capitals,Dubai International Cricket Stadium,R R Pant (c S A Yadav),4.0,1/22,,26.67,7.23,46,32.13
71,10/11/2020,1st,Delhi Capitals,Dubai International Cricket Stadium,,3.0,0/30,,27.07,7.27,46,32.78
72,09/04/2021,2nd,Royal Challengers Bengaluru,MA Chidambaram Stadium,Washington Sundar (c C A Lynn),4.0,1/25,,27.00,7.25,47,32.62
73,13/04/2021,2nd,Kolkata Knight Riders,MA Chidambaram Stadium,Shakib Al Hasan (c S A Yadav),4.0,1/13,,26.94,7.17,48,32.21
74,17/04/2021,2nd,Sunrisers Hyderabad,MA Chidambaram Stadium,J M Bairstow (hit wicket),3.0,1/30,,26.76,7.21,49,32.16
75,20/04/2021,2nd,Delhi Capitals,MA Chidambaram Stadium,,2.0,0/17,,27.00,7.22,49,32.51
76,23/04/2021,2nd,Punjab Kings,MA Chidambaram Stadium,,3.0,0/31,,27.37,7.27,49,33.14
77,29/04/2021,1st,Rajasthan Royals,Arun Jaitley Stadium,,1.0,0/12,,27.49,7.29,49,33.39
78,01/05/2021,1st,Chennai Super Kings,Arun Jaitley Stadium,did not bowl,,,,27.49,7.29,49,33.39
79,19/09/2021,1st,Chennai Super Kings,Dubai International Cricket Stadium,,2.0,0/27,,27.73,7.34,49,33.94
80,23/09/2021,2nd,Kolkata Knight Riders,Sheikh Zayed Stadium,,3.0,0/25,,28.10,7.36,49,34.45
81,26/09/2021,1st,Royal Challengers Bengaluru,Dubai International Cricket Stadium,,4.0,0/27,,28.59,7.34,49,35.00
82,28/09/2021,1st,Punjab Kings,Sheikh Zayed Stadium,Mandeep Singh (lbw),4.0,1/24,,28.50,7.32,50,34.78
83,02/10/2021,2nd,Delhi Capitals,Sharjah Cricket Stadium,P P Shaw (lbw),2.1,1/18,,28.20,7.33,51,34.45
84,08/10/2021,2nd,Sunrisers Hyderabad,Sheikh Zayed Stadium,,1.0,0/16,,28.31,7.37,51,34.76
85,28/03/2022,2nd,Gujarat Titans,Wankhede Stadium,H H Pandya (c M K Pandey),4.0,1/17,,28.23,7.32,52,34.42
86,31/03/2022,1st,Chennai Super Kings,Brabourne Stadium,,3.0,0/36,,28.58,7.37,52,35.12
87,04/04/2022,2nd,Sunrisers Hyderabad,Dr DY Patil Sports Academy,A K Markram (c K L Rahul),4.0,2/27,,27.96,7.36,53,34.31
,,,,,R A Tripathi (c Ravi Bishnoi),,,,,,54,
88,07/04/2022,1st,Delhi Capitals,Dr DY Patil Sports Academy,,2.0,0/12,,28.19,7.35,54,34.54
89,10/04/2022,1st,Rajasthan Royals,Wankhede Stadium,did not bowl,,,,28.19,7.35,54,34.54
90,16/04/2022,2nd,Mumbai Indians,Brabourne Stadium,,2.0,0/16,,28.41,7.36,54,34.83
91,19/04/2022,1st,Royal Challengers Bengaluru,Dr DY Patil Sports Academy,G J Maxwell (c J O Holder),4.0,1/29,,28.33,7.36,55,34.73
92,24/04/2022,2nd,Mumbai Indians,Wankhede Stadium,R G Sharma (c sub),4.0,3/19,,27.28,7.32,56,33.26
,,,,,K A Pollard (c D J Hooda),,,,,,57,
,,,,,D R Sams (c Ravi Bishnoi),,,,,,58,
93,29/04/2022,2nd,Punjab Kings,Maharashtra Cricket Association Stadium,P B B Rajapaksa (c K L Rahul),4.0,2/11,,26.77,7.25,59,32.33
,,,,,J M Sharma (lbw),,,,,,60,
94,01/05/2022,2nd,Delhi Capitals,Wankhede Stadium,,1.0,0/19,,26.87,7.29,60,32.65
95,07/05/2022,2nd,Kolkata Knight Riders,Maharashtra Cricket Association Stadium,did not bowl,,,,26.87,7.29,60,32.65
96,10/05/2022,1st,Gujarat Titans,Maharashtra Cricket Association Stadium,,4.0,0/24,,27.27,7.27,60,33.05
97,15/05/2022,1st,Rajasthan Royals,Brabourne Stadium,,2.0,0/16,,27.47,7.28,60,33.32
98,25/05/2022,1st,Royal Challengers Bengaluru,Eden Gardens,G J Maxwell (c E Lewis),4.0,1/39,,27.41,7.31,61,33.41
99,01/04/2023,2nd,Delhi Capitals,BRSABV Ekana Cricket Stadium,did not bowl,,,,27.41,7.31,61,33.41
100,03/04/2023,1st,Chennai Super Kings,MA Chidambaram Stadium,,2.0,0/21,,27.61,7.34,61,33.75
101,07/04/2023,1st,Sunrisers Hyderabad,BRSABV Ekana Cricket Stadium,M A Agarwal (c M P Stoinis),4.0,3/18,,26.69,7.30,62,32.45
,,,,,Anmolpreet Singh (lbw),,,,,,63,
,,,,,A K Markram (b),,,,,,64,
102,10/04/2023,1st,Royal Challengers Bengaluru,M Chinnaswamy Stadium,,4.0,0/35,,27.06,7.32,64,33.00
103,15/04/2023,2nd,Punjab Kings,BRSABV Ekana Cricket Stadium,Harpreet Singh (c sub),3.0,1/32,,26.92,7.35,65,32.98
104,19/04/2023,2nd,Rajasthan Royals,Sawai Mansingh Stadium,did not bowl,,,,26.92,7.35,65,32.98
105,22/04/2023,1st,Gujarat Titans,BRSABV Ekana Cricket Stadium,Shubman Gill (c Ravi Bishnoi),4.0,2/16,,26.48,7.31,66,32.24
,,,,,W P Saha (c D J Hooda),,,,,,67,
106,28/04/2023,2nd,Punjab Kings,Punjab Cricket Association IS Bindra Stadium,,1.0,0/13,,26.57,7.32,67,32.43
107,01/05/2023,1st,Royal Challengers Bengaluru,BRSABV Ekana Cricket Stadium,,4.0,0/21,,26.93,7.30,67,32.75
108  (c),03/05/2023,2nd,Chennai Super Kings,BRSABV Ekana Cricket Stadium,did not bowl,,,,26.93,7.30,67,32.75
109  (c),07/05/2023,1st,Gujarat Titans,Narendra Modi Stadium,,4.0,0/38,,27.28,7.33,67,33.31
110  (c),13/05/2023,1st,Sunrisers Hyderabad,Rajiv Gandhi International Stadium,A K Markram (st Q de Kock),4.0,2/24,,26.84,7.31,68,32.70
,,,,,G D Phillips (b),,,,,,69,
111  (c),16/05/2023,2nd,Mumbai Indians,BRSABV Ekana Cricket Stadium,,4.0,0/27,,27.19,7.30,69,33.09
112  (c),20/05/2023,2nd,Kolkata Knight Riders,Eden Gardens,J J Roy (b),4.0,1/30,,27.14,7.30,70,33.04
113  (c),24/05/2023,1st,Mumbai Indians,MA Chidambaram Stadium,,4.0,0/38,,27.49,7.33,70,33.59
114,24/03/2024,1st,Rajasthan Royals,Sawai Mansingh Stadium,,4.0,0/19,,27.83,7.30,70,33.86
115,30/03/2024,2nd,Punjab Kings,BRSABV Ekana Cricket Stadium,,3.0,0/26,,28.09,7.31,70,34.23
116,02/04/2024,2nd,Royal Challengers Bengaluru,M Chinnaswamy Stadium,,1.0,0/10,,28.17,7.32,70,34.37
117,07/04/2024,2nd,Gujarat Titans,BRSABV Ekana Cricket Stadium,Sai Sudharsan (c Ravi Bishnoi),4.0,3/11,,27.34,7.27,71,33.11
,,,,,BR Sharath (c A Badoni),,,,,,72,
,,,,,D G Nalkande (c Y Thakur),,,,,,73,
118,12/04/2024,2nd,Delhi Capitals,BRSABV Ekana Cricket Stadium,,3.0,0/45,,27.59,7.33,73,33.73
119,14/04/2024,2nd,Kolkata Knight Riders,Eden Gardens,,1.0,0/14,,27.67,7.35,73,33.92
120,19/04/2024,1st,Chennai Super Kings,BRSABV Ekana Cricket Stadium,A M Rahane (b),3.0,2/16,,27.17,7.34,74,33.23
,,,,,S Rizvi (st K L Rahul),,,,,,75,
121,23/04/2024,1st,Chennai Super Kings,MA Chidambaram Stadium,,2.0,0/15,,27.33,7.34,75,33.43
122,27/04/2024,2nd,Rajasthan Royals,BRSABV Ekana Cricket Stadium,,4.0,0/24,,27.65,7.32,75,33.75
123,30/04/2024,1st,Mumbai Indians,BRSABV Ekana Cricket Stadium,did not bowl,,,,27.65,7.32,75,33.75
124,05/05/2024,1st,Kolkata Knight Riders,BRSABV Ekana Cricket Stadium,,2.0,0/26,,27.81,7.35,75,34.09
125,08/05/2024,2nd,Sunrisers Hyderabad,Rajiv Gandhi International Stadium,did not bowl,,,,27.81,7.35,75,34.09
126,14/05/2024,1st,Delhi Capitals,Arun Jaitley Stadium,,2.0,0/20,,27.97,7.37,75,34.36
127,17/05/2024,2nd,Mumbai Indians,Wankhede Stadium,S A Yadav (c Ravi Bishnoi),4.0,1/29,,27.92,7.37,76,34.29
128,22/03/2025,1st,Kolkata Knight Riders,Eden Gardens,A M Rahane (c Rasikh Salam),4.0,3/29,,27.16,7.37,77,33.35
,,,,,V R Iyer (b),,,,,,78,
,,,,,Rinku Singh (b),,,,,,79,
129,28/03/2025,2nd,Chennai Super Kings,MA Chidambaram Stadium,,2.0,0/26,,27.32,7.40,79,33.68
130,02/04/2025,2nd,Gujarat Titans,M Chinnaswamy Stadium,,3.0,0/34,,27.54,7.43,79,34.11
131,07/04/2025,2nd,Mumbai Indians,Wankhede Stadium,W G Jacks (c V Kohli),4.0,4/45,,26.51,7.47,80,33.01
,,,,,M J Santner (c T H David),,,,,,81,
,,,,,D L Chahar (c T H David),,,,,,82,
,,,,,Naman Dhir (c Y Dayal),,,,,,83,
132,10/04/2025,2nd,Delhi Capitals,M Chinnaswamy Stadium,,2.0,0/19,,26.65,7.48,83,33.24
133,13/04/2025,1st,Rajasthan Royals,Sawai Mansingh Stadium,S V Samson (st J M Sharma),4.0,1/29,,26.62,7.48,84,33.19
134,18/04/2025,2nd,Punjab Kings,M Chinnaswamy Stadium,,1.0,0/10,,26.69,7.49,84,33.31
135,20/04/2025,1st,Punjab Kings,Maharaja Yadavindra Singh International Cricket St,P Arya (c T H David),4.0,2/25,,26.35,7.47,85,32.83
,,,,,Prabhsimran Singh (c T H David),,,,,,86,
136,24/04/2025,2nd,Rajasthan Royals,M Chinnaswamy Stadium,R Parag (c †J M Sharma),4.0,2/31,,26.02,7.48,87,32.43
,,,,,N Rana (c B Kumar),,,,,,88,
137,27/04/2025,1st,Delhi Capitals,Arun Jaitley Stadium,F du Plessis (c V Kohli),4.0,1/28,,26.00,7.47,89,32.38
138,03/05/2025,2nd,Chennai Super Kings,M Chinnaswamy Stadium,Shaik Rasheed (c R Shepherd),3.0,1/24,,25.91,7.48,90,32.29
139,23/05/2025,1st,Sunrisers Hyderabad,BRSABV Ekana Cricket Stadium,A Verma (c B Kumar),4.0,1/38,,25.89,7.50,91,32.35
140,27/05/2025,1st,Lucknow Super Giants,BRSABV Ekana Cricket Stadium,,2.0,0/14,,26.02,7.49,91,32.51
141,29/05/2025,1st,Punjab Kings,Maharaja Yadavindra Singh International Cricket St,,1.0,0/10,,26.09,7.50,91,32.62
