,Match,Innings,Date,M/Inns,Posn,Versus,Ground,How Dismissed,Runs,B/F,S/R,,Runs,B/F,Avg,S/R
0,1,1,22/09/2020,2nd,5,Rajasthan Royals,Sharjah Cricket Stadium,st S V Samson b R Tewatia,0,1,0.00,,0,1,0.00,0.00
1,2,2,25/09/2020,2nd,4,Delhi Capitals,Dubai International Cricket Stadium,run out,5,10,50.00,,5,11,2.50,45.45
2,3,3,23/10/2020,1st,1,Mumbai Indians,Sharjah Cricket Stadium,lbw b T A Boult,0,5,0.00,,5,16,1.67,31.25
3,4,4,25/10/2020,2nd,1,Royal Challengers Bengaluru,Dubai International Cricket Stadium,not out,65*,51,127.45,,70,67,23.33,104.48
4,5,5,29/10/2020,2nd,2,Kolkata Knight Riders,Dubai International Cricket Stadium,b P J Cummins,72,53,135.85,,142,120,35.50,118.33
5,6,6,01/11/2020,2nd,1,Punjab Kings,Sheikh Zayed Stadium,not out,62*,49,126.53,,204,169,51.00,120.71
6,7,7,10/04/2021,1st,1,Delhi Capitals,Wankhede Stadium,c S Dhawan b C R Woakes,5,8,62.50,,209,177,41.80,118.08
7,8,8,16/04/2021,2nd,1,Punjab Kings,Wankhede Stadium,c D J Hooda b Arshdeep Singh,5,16,31.25,,214,193,35.67,110.88
8,9,9,19/04/2021,1st,1,Rajasthan Royals,Wankhede Stadium,c S Dube b Mustafizur Rahman,10,13,76.92,,224,206,32.00,108.74
9,10,10,21/04/2021,1st,1,Kolkata Knight Riders,Wankhede Stadium,c P J Cummins b C V Varun,64,42,152.38,,288,248,36.00,116.13
10,11,11,25/04/2021,1st,1,Royal Challengers Bengaluru,Wankhede Stadium,c K A Jamieson b Y S Chahal,33,25,132.00,,321,273,35.67,117.58
11,12,12,28/04/2021,2nd,1,Sunrisers Hyderabad,Arun Jaitley Stadium,b Rashid Khan,75,44,170.45,,396,317,39.60,124.92
12,13,13,01/05/2021,1st,1,Mumbai Indians,Arun Jaitley Stadium,c H H Pandya b T A Boult,4,4,100.00,,400,321,36.36,124.61
13,14,14,19/09/2021,1st,1,Mumbai Indians,Dubai International Cricket Stadium,not out,88*,58,151.72,,488,379,44.36,128.76
14,15,15,24/09/2021,2nd,1,Royal Challengers Bengaluru,Sharjah Cricket Stadium,c V Kohli b Y S Chahal,38,26,146.15,,526,405,43.83,129.88
15,16,16,26/09/2021,2nd,1,Kolkata Knight Riders,Sheikh Zayed Stadium,c E J G Morgan b A D Russell,40,28,142.86,,566,433,43.54,130.72
16,17,17,30/09/2021,2nd,1,Sunrisers Hyderabad,Sharjah Cricket Stadium,c K S Williamson b J O Holder,45,38,118.42,,611,471,43.64,129.72
17,18,18,02/10/2021,1st,1,Rajasthan Royals,Sheikh Zayed Stadium,not out,101*,60,168.33,,712,531,50.86,134.09
18,19,19,04/10/2021,1st,1,Delhi Capitals,Dubai International Cricket Stadium,c R Ashwin b A Nortje,13,13,100.00,,725,544,48.33,133.27
19,20,20,07/10/2021,1st,1,Punjab Kings,Dubai International Cricket Stadium,c Shahrukh Khan b Arshdeep Singh,12,14,85.71,,737,558,46.06,132.08
20,21,21,10/10/2021,2nd,1,Delhi Capitals,Dubai International Cricket Stadium,c A R Patel b Avesh Khan,70,50,140.00,,807,608,47.47,132.73
21,22,22,15/10/2021,1st,1,Kolkata Knight Riders,Dubai International Cricket Stadium,c Shivam Mavi b S P Narine,32,27,118.52,,839,635,46.61,132.13
22,23,23,26/03/2022,1st,1,Kolkata Knight Riders,Wankhede Stadium,c N Rana b U T Yadav,0,4,0.00,,839,639,44.16,131.30
23,24,24,31/03/2022,1st,2,Lucknow Super Giants,Brabourne Stadium,run out,1,4,25.00,,840,643,42.00,130.64
24,25,25,03/04/2022,2nd,2,Punjab Kings,Brabourne Stadium,c S Dhawan b K Rabada,1,4,25.00,,841,647,40.05,129.98
25,26,26,09/04/2022,1st,2,Sunrisers Hyderabad,Dr DY Patil Sports Academy,b T Natarajan,16,13,123.08,,857,660,38.95,129.85
26,27,27,12/04/2022,1st,1,Royal Challengers Bengaluru,Dr DY Patil Sports Academy,lbw b J R Hazlewood,17,16,106.25,,874,676,38.00,129.29
27,28,28,17/04/2022,1st,1,Gujarat Titans,Maharashtra Cricket Association Stadium,c A Manohar b Y Dayal,73,48,152.08,,947,724,39.46,130.80
28,29,29,21/04/2022,2nd,1,Mumbai Indians,Dr DY Patil Sports Academy,c Tilak Varma b D R Sams,0,1,0.00,,947,725,37.88,130.62
29,30,30,25/04/2022,2nd,1,Punjab Kings,Wankhede Stadium,c M A Agarwal b K Rabada,30,27,111.11,,977,752,37.58,129.92
30,31,31,01/05/2022,1st,1,Sunrisers Hyderabad,Maharashtra Cricket Association Stadium,c B Kumar b T Natarajan,99,57,173.68,,1076,809,39.85,133.00
31,32,32,04/05/2022,2nd,1,Royal Challengers Bengaluru,Maharashtra Cricket Association Stadium,c sub b Shahbaz Ahmed,28,23,121.74,,1104,832,39.43,132.69
32,33,33,08/05/2022,1st,1,Delhi Capitals,Dr DY Patil Sports Academy,c A R Patel b A Nortje,41,33,124.24,,1145,865,39.48,132.37
33,34,34,12/05/2022,1st,1,Mumbai Indians,Wankhede Stadium,c †Ishan Kishan b D R Sams,7,6,116.67,,1152,871,38.40,132.26
34,35,35,15/05/2022,1st,1,Gujarat Titans,Wankhede Stadium,c M S Wade b Rashid Khan,53,49,108.16,,1205,920,38.87,130.98
35,36,36,20/05/2022,1st,1,Rajasthan Royals,Brabourne Stadium,c †S V Samson b T A Boult,2,6,33.33,,1207,926,37.72,130.35
36,37,37,31/03/2023,1st,2,Gujarat Titans,Narendra Modi Stadium,c Shubman Gill b A S Joseph,92,50,184.00,,1299,976,39.36,133.09
37,38,38,03/04/2023,1st,1,Lucknow Super Giants,MA Chidambaram Stadium,c M A Wood b Ravi Bishnoi,57,31,183.87,,1356,1007,39.88,134.66
38,39,39,08/04/2023,2nd,2,Mumbai Indians,Wankhede Stadium,not out,40*,36,111.11,,1396,1043,41.06,133.84
39,40,40,12/04/2023,2nd,1,Rajasthan Royals,MA Chidambaram Stadium,c Y B K Jaiswal b Sandeep Sharma,8,10,80.00,,1404,1053,40.11,133.33
40,41,41,17/04/2023,1st,1,Royal Challengers Bengaluru,M Chinnaswamy Stadium,c W D Parnell b Mohammed Siraj,3,6,50.00,,1407,1059,39.08,132.86
41,42,42,21/04/2023,2nd,1,Sunrisers Hyderabad,MA Chidambaram Stadium,run out,35,30,116.67,,1442,1089,38.97,132.42
42,43,43,23/04/2023,1st,1,Kolkata Knight Riders,Eden Gardens,b S Sharma,35,20,175.00,,1477,1109,38.87,133.18
43,44,44,27/04/2023,2nd,1,Rajasthan Royals,Sawai Mansingh Stadium,c D Padikkal b A Zampa,47,29,162.07,,1524,1138,39.08,133.92
44,45,45,30/04/2023,1st,1,Punjab Kings,MA Chidambaram Stadium,st J M Sharma b Sikandar Raza,37,31,119.35,,1561,1169,39.03,133.53
45,46,,03/05/2023,2nd,-,Lucknow Super Giants,BRSABV Ekana Cricket Stadium,did not bat,-,-,-,,1561,1169,39.03,133.53
46,47,46,06/05/2023,2nd,1,Mumbai Indians,MA Chidambaram Stadium,c †Ishan Kishan b P P Chawla,30,16,187.50,,1591,1185,38.80,134.26
47,48,47,10/05/2023,1st,1,Delhi Capitals,MA Chidambaram Stadium,c Aman Hakim Khan b A R Patel,24,18,133.33,,1615,1203,38.45,134.25
48,49,48,14/05/2023,1st,1,Kolkata Knight Riders,MA Chidambaram Stadium,c V G Arora b C V Varun,17,13,130.77,,1632,1216,37.95,134.21
49,50,49,20/05/2023,1st,1,Delhi Capitals,Arun Jaitley Stadium,c R R Rossouw b C Sakariya,79,50,158.00,,1711,1266,38.89,135.15
50,51,50,23/05/2023,1st,1,Gujarat Titans,MA Chidambaram Stadium,c D A Miller b M M Sharma,60,44,136.36,,1771,1310,39.36,135.19
51,52,51,29/05/2023,2nd,1,Gujarat Titans,Narendra Modi Stadium,c Rashid Khan b Noor Ahmad,26,16,162.50,,1797,1326,39.07,135.52
52,53  (c),52,22/03/2024,2nd,1,Royal Challengers Bengaluru,MA Chidambaram Stadium,c C Green b Y Dayal,15,15,100.00,,1812,1341,38.55,135.12
53,54  (c),53,26/03/2024,1st,1,Gujarat Titans,MA Chidambaram Stadium,c †W P Saha b S H Johnson,46,36,127.78,,1858,1377,38.71,134.93
54,55  (c),54,31/03/2024,2nd,1,Delhi Capitals,Dr YS Rajasekhara Reddy Cricket Stadium,c †R R Pant b K K Ahmed,1,2,50.00,,1859,1379,37.94,134.81
55,56  (c),55,05/04/2024,1st,2,Sunrisers Hyderabad,Rajiv Gandhi International Stadium,c Abdul Samad b Shahbaz Ahmed,26,21,123.81,,1885,1400,37.70,134.64
56,57  (c),56,08/04/2024,2nd,2,Kolkata Knight Riders,MA Chidambaram Stadium,not out,67*,58,115.52,,1952,1458,39.04,133.88
57,58  (c),57,14/04/2024,1st,3,Mumbai Indians,Wankhede Stadium,c Mohammad Nabi b H H Pandya,69,40,172.50,,2021,1498,39.63,134.91
58,59  (c),58,19/04/2024,1st,3,Lucknow Super Giants,BRSABV Ekana Cricket Stadium,c †K L Rahul b Y Thakur,17,13,130.77,,2038,1511,39.19,134.88
59,60  (c),59,23/04/2024,1st,2,Lucknow Super Giants,MA Chidambaram Stadium,not out,108*,60,180.00,,2146,1571,41.27,136.60
60,61  (c),60,28/04/2024,1st,2,Sunrisers Hyderabad,MA Chidambaram Stadium,c N K Reddy b T Natarajan,98,54,181.48,,2244,1625,42.34,138.09
61,62  (c),61,01/05/2024,1st,2,Punjab Kings,MA Chidambaram Stadium,b Arshdeep Singh,62,48,129.17,,2306,1673,42.70,137.84
62,63  (c),62,05/05/2024,1st,2,Punjab Kings,Himachal Pradesh Cricket Association Stadium,c †J M Sharma b R D Chahar,32,21,152.38,,2338,1694,42.51,138.02
63,64  (c),63,10/05/2024,2nd,3,Gujarat Titans,Narendra Modi Stadium,c Rashid Khan b U T Yadav,0,3,0.00,,2338,1697,41.75,137.77
64,65  (c),64,12/05/2024,2nd,2,Rajasthan Royals,MA Chidambaram Stadium,not out,42*,41,102.44,,2380,1738,42.50,136.94
65,66  (c),65,18/05/2024,2nd,1,Royal Challengers Bengaluru,M Chinnaswamy Stadium,c Y Dayal b G J Maxwell,0,1,0.00,,2380,1739,41.75,136.86
66,67  (c),66,23/03/2025,2nd,3,Mumbai Indians,MA Chidambaram Stadium,c W G Jacks b V Puthur,53,26,203.85,,2433,1765,41.95,137.85
67,68  (c),67,28/03/2025,2nd,3,Royal Challengers Bengaluru,MA Chidambaram Stadium,c sub b J R Hazlewood,0,4,0.00,,2433,1769,41.24,137.54
68,69  (c),68,30/03/2025,2nd,3,Rajasthan Royals,Barsapara Cricket Stadium,c Y B K Jaiswal b P W H de Silva,63,44,143.18,,2496,1813,41.60,137.67
69,70  (c),69,05/04/2025,2nd,3,Delhi Capitals,MA Chidambaram Stadium,c J Fraser-McGurk b M A Starc,5,4,125.00,,2501,1817,41.00,137.64
70,71  (c),70,08/04/2025,2nd,3,Punjab Kings,Maharaja Yadavindra Singh International Cricket St,c S Singh b L H Ferguson,1,3,33.33,,2502,1820,40.35,137.47
